{
  "$schema": "../../docs/schemas/toolhost.schema.json",
  "bind": {
    "host": "127.0.0.1",
    "port": 8765,
    "transport": "streamable-http",
    "transports": [
      "http",
      "sse"
    ]
  },
  "token_file": "user_db/.local_mcp_token",
  "families": [
    "fs",
    "shell",
    "git",
    "office",
    "skill_run",
    "browser",
    "desktop"
  ],
  "familles_natives": [
    "browser",
    "desktop",
    "fs",
    "git",
    "shell",
    "skill_run"
  ],
  "sandbox_dir": "../user_sandboxes",
  "db_path": "user_db/toolhost.db",
  "app_url": "https://elpis.example.lan",
  "mcp_upstream": "http://127.0.0.1:8767/mcp",
  "playwright_api_url": "http://127.0.0.1:3000",
  "assets": {
    "pw_dir": "/var/lib/elpis/pw_screens",
    "desktop_dir": "/var/lib/elpis/desktop_screens"
  },
  "identity_max_skew_s": 60
}
